{
  "schemaVersion": 1,
  "caseId": "heldout.agent-mcp-development.memory-context-retrieval.mature-legacy-migration",
  "intent": "agent-mcp-development",
  "targets": [
    {
      "host": "codex",
      "scope": "project"
    }
  ],
  "profile": {
    "projectStage": "legacy-migration",
    "legacySystem": "keyword-only-knowledge-search",
    "knowledgeScale": "large-document-archive",
    "constraints": [
      "preserve-existing-index",
      "phased-embedding-adoption",
      "citation-parity",
      "rollback"
    ]
  },
  "criticalGoals": [
    "migrate retrieval without reducing recall or attribution",
    "introduce semantic retrieval through a reversible transition"
  ],
  "nonCriticalGoals": [
    "add hybrid ranking",
    "measure retrieval quality against legacy search"
  ],
  "minimumNonCriticalGoalCoverage": 0.8,
  "requiresSkill": true,
  "policy": {
    "allowedRisk": [
      "none",
      "safe"
    ],
    "requireKnownSource": false,
    "allowManualSetup": false
  },
  "provenance": {
    "source": "independent-synthetic-held-out",
    "version": "1.0.0",
    "reviewedAt": "2026-07-17"
  },
  "taskFamilyFingerprint": "tf.agent-mcp-development.memory-context-retrieval.mature-legacy-migration"
}
