{
  "schemaVersion": 1,
  "caseId": "heldout.agent-mcp-development.memory-context-retrieval.constrained-offline",
  "intent": "agent-mcp-development",
  "targets": [
    {
      "host": "claude",
      "scope": "project"
    }
  ],
  "profile": {
    "projectStage": "greenfield",
    "deployment": "offline-field-laptop",
    "agentShape": "local-maintenance-assistant",
    "knowledgeScale": "thousands-of-manual-pages",
    "constraints": [
      "local-embeddings",
      "bounded-disk",
      "no-cloud-vector-store",
      "incremental-media-updates"
    ]
  },
  "criticalGoals": [
    "build effective retrieval entirely on-device",
    "bound index and context resource usage"
  ],
  "nonCriticalGoals": [
    "support incremental offline updates",
    "retain citations into local manuals"
  ],
  "minimumNonCriticalGoalCoverage": 0.8,
  "requiresSkill": true,
  "policy": {
    "allowedRisk": [
      "none",
      "safe"
    ],
    "requireKnownSource": false,
    "allowManualSetup": false
  },
  "provenance": {
    "source": "independent-synthetic-held-out",
    "version": "1.0.0",
    "reviewedAt": "2026-07-17"
  },
  "taskFamilyFingerprint": "tf.agent-mcp-development.memory-context-retrieval.constrained-offline"
}
