{
  "schemaVersion": 1,
  "caseId": "heldout.deployment-devops.ci-cd.regulated-high-assurance",
  "intent": "deployment-devops",
  "targets": [
    {
      "host": "codex",
      "scope": "project"
    },
    {
      "host": "claude",
      "scope": "project"
    }
  ],
  "profile": {
    "product": "Payment clearing platform",
    "stack": {
      "languages": [
        "Java",
        "Go"
      ],
      "runtime": "signed containers",
      "delivery": "segregated controlled environments"
    },
    "team": {
      "engineers": 18,
      "operationsModel": "segregated platform and release roles",
      "experience": "high assurance"
    },
    "environment": {
      "maturity": "regulated production",
      "topology": "multi-zone services with controlled environments",
      "connectivity": "egress allowlisted"
    },
    "constraints": [
      "auditable approvals",
      "least-privilege automation",
      "immutable evidence retention",
      "tested rollback"
    ],
    "policy": {
      "allowedRisk": [
        "none",
        "safe"
      ],
      "requireKnownSource": true,
      "allowManualSetup": false
    },
    "desiredOutcome": "produce an auditable pipeline with enforced separation of duties"
  },
  "criticalGoals": [
    "prevent unapproved production promotion",
    "bind deployed artifacts to immutable evidence"
  ],
  "nonCriticalGoals": [
    "cache dependencies safely",
    "retain validation evidence",
    "separate deployment identity",
    "make failures diagnosable",
    "document recovery"
  ],
  "minimumNonCriticalGoalCoverage": 0.8,
  "requiresSkill": true,
  "policy": {
    "allowedRisk": [
      "none",
      "safe"
    ],
    "requireKnownSource": false,
    "allowManualSetup": false
  },
  "provenance": {
    "source": "AAS benchmark editorial scenario based on ci-cd delivery practice",
    "version": "1.0.0",
    "reviewedAt": "2026-07-17"
  },
  "taskFamilyFingerprint": "tf.deployment-devops.ci-cd.regulated-high-assurance"
}
