{
  "schemaVersion": 1,
  "caseId": "heldout.api-backend-delivery.persistence-data.production-greenfield",
  "intent": "api-backend-delivery",
  "targets": [
    {
      "host": "claude",
      "scope": "project"
    }
  ],
  "profile": {
    "projectStage": "production-greenfield",
    "teamSize": 16,
    "languages": [
      "java"
    ],
    "frameworks": [
      "spring",
      "hibernate"
    ],
    "datastores": [
      "postgresql"
    ],
    "constraints": [
      "high-write-volume",
      "zero-downtime-migrations",
      "point-in-time-recovery"
    ]
  },
  "criticalGoals": [
    "design a production relational data model",
    "plan backward-compatible zero-downtime migrations"
  ],
  "nonCriticalGoals": [
    "optimize indexes and query plans",
    "define integrity and retention controls"
  ],
  "minimumNonCriticalGoalCoverage": 0.8,
  "requiresSkill": true,
  "policy": {
    "allowedRisk": [
      "none",
      "safe"
    ],
    "requireKnownSource": false,
    "allowManualSetup": false
  },
  "provenance": {
    "source": "independent-synthetic-held-out",
    "version": "1.0.0",
    "reviewedAt": "2026-07-17"
  },
  "taskFamilyFingerprint": "tf.api-backend-delivery.persistence-data.production-greenfield"
}
