{
  "schemaVersion": 1,
  "caseId": "heldout.agent-mcp-development.memory-context-retrieval.small-greenfield",
  "intent": "agent-mcp-development",
  "targets": [
    {
      "host": "codex",
      "scope": "project"
    }
  ],
  "profile": {
    "projectStage": "greenfield",
    "teamSize": 2,
    "agentShape": "project-assistant",
    "knowledgeScale": "hundreds-of-documents",
    "constraints": [
      "local-files",
      "short-context-window",
      "simple-operations"
    ]
  },
  "criticalGoals": [
    "design compact short-term and durable agent memory",
    "retrieve only relevant evidence into context"
  ],
  "nonCriticalGoals": [
    "define forgetting and consolidation",
    "preserve source references for recalled facts"
  ],
  "minimumNonCriticalGoalCoverage": 0.8,
  "requiresSkill": true,
  "policy": {
    "allowedRisk": [
      "none",
      "safe"
    ],
    "requireKnownSource": false,
    "allowManualSetup": false
  },
  "provenance": {
    "source": "independent-synthetic-held-out",
    "version": "1.0.0",
    "reviewedAt": "2026-07-17"
  },
  "taskFamilyFingerprint": "tf.agent-mcp-development.memory-context-retrieval.small-greenfield"
}
