{
  "schemaVersion": 1,
  "caseId": "heldout.security-review-hardening.incident-hardening.mature-legacy-migration",
  "intent": "security-review-hardening",
  "targets": [
    {
      "host": "codex",
      "scope": "project"
    }
  ],
  "profile": {
    "archetype": "mature-legacy-migration",
    "projectSummary": "Owned legacy customer portal hardening after stale privileged sessions survived a migration cutover",
    "stack": {
      "languages": [
        "java",
        "typescript"
      ],
      "frameworks": [
        "spring",
        "react"
      ],
      "identity": [
        "legacy-session",
        "oidc-bridge"
      ],
      "deployment": [
        "hybrid-cloud"
      ]
    },
    "constraints": [
      "incident contained",
      "dual session stores remain temporarily",
      "phased fix required"
    ],
    "authorization": {
      "scope": "defensive session-exposure review and remediation validation for owned systems",
      "mode": "read-only",
      "productionChanges": "approval-required"
    },
    "policy": {
      "allowedRisk": [
        "none",
        "safe"
      ],
      "requireKnownSource": false,
      "allowManualSetup": false
    }
  },
  "criticalGoals": [
    "identify remaining stale-session paths",
    "verify invalidation across both systems",
    "harden migration rollback"
  ],
  "nonCriticalGoals": [
    "sequence legacy retirement",
    "document recurrence monitoring"
  ],
  "minimumNonCriticalGoalCoverage": 0.8,
  "requiresSkill": true,
  "policy": {
    "allowedRisk": [
      "none",
      "safe"
    ],
    "requireKnownSource": false,
    "allowManualSetup": false
  },
  "provenance": {
    "source": "aas-v1-independent-synthetic-profile",
    "version": "1.0.0",
    "reviewedAt": "2026-07-17"
  },
  "taskFamilyFingerprint": "tf.security-review-hardening.incident-hardening.mature-legacy-migration"
}
