{
  "schemaVersion": 1,
  "caseId": "tuning.api-backend-delivery.persistence-data.inventory-modernization",
  "intent": "api-backend-delivery",
  "targets": [
    {
      "host": "claude",
      "scope": "project"
    }
  ],
  "profile": {
    "projectType": "inventory service modernization",
    "languages": [
      "Python",
      "SQL"
    ],
    "frameworks": [
      "PostgreSQL"
    ],
    "context": "legacy schema split into service-owned tables",
    "constraints": [
      "reversible rollout",
      "query performance safeguards"
    ]
  },
  "criticalGoals": [
    "data-model-design",
    "reversible-migrations"
  ],
  "nonCriticalGoals": [
    "query-discipline",
    "migration-safety"
  ],
  "minimumNonCriticalGoalCoverage": 0.8,
  "requiresSkill": true,
  "policy": {
    "allowedRisk": [
      "none",
      "safe"
    ],
    "requireKnownSource": false,
    "allowManualSetup": false
  },
  "provenance": {
    "source": "independent-synthetic-tuning-authoring",
    "version": "1.0.0",
    "reviewedAt": "2026-07-17"
  },
  "taskFamilyFingerprint": "tuning.v1.api-backend-delivery.persistence-data.inventory-modernization"
}
