{
  "schemaVersion": 1,
  "caseId": "heldout.security-review-hardening.secrets-auth.monorepo-polyglot",
  "intent": "security-review-hardening",
  "targets": [
    {
      "host": "codex",
      "scope": "project"
    },
    {
      "host": "claude",
      "scope": "project"
    }
  ],
  "profile": {
    "archetype": "monorepo-polyglot",
    "projectSummary": "Owned platform monorepo with TypeScript gateway, Python workers and Go internal services sharing OIDC",
    "stack": {
      "languages": [
        "typescript",
        "python",
        "go"
      ],
      "frameworks": [
        "node",
        "fastapi"
      ],
      "identity": [
        "oidc",
        "service-identities"
      ],
      "deployment": [
        "aws",
        "kubernetes"
      ]
    },
    "constraints": [
      "shared CI variables",
      "service-specific roles",
      "no credential values supplied"
    ],
    "authorization": {
      "scope": "defensive identity and secret-boundary review of owned components",
      "mode": "non-destructive",
      "productionChanges": "approval-required"
    },
    "policy": {
      "allowedRisk": [
        "none",
        "safe"
      ],
      "requireKnownSource": false,
      "allowManualSetup": false
    }
  },
  "criticalGoals": [
    "enforce service-specific least privilege",
    "separate secrets across package boundaries",
    "review gateway authentication controls"
  ],
  "nonCriticalGoals": [
    "standardize rotation ownership",
    "document cross-service trust"
  ],
  "minimumNonCriticalGoalCoverage": 0.8,
  "requiresSkill": true,
  "policy": {
    "allowedRisk": [
      "none",
      "safe"
    ],
    "requireKnownSource": false,
    "allowManualSetup": false
  },
  "provenance": {
    "source": "aas-v1-independent-synthetic-profile",
    "version": "1.0.0",
    "reviewedAt": "2026-07-17"
  },
  "taskFamilyFingerprint": "tf.security-review-hardening.secrets-auth.monorepo-polyglot"
}
