{
  "schemaVersion": 1,
  "caseId": "heldout.api-backend-delivery.persistence-data.small-greenfield",
  "intent": "api-backend-delivery",
  "targets": [
    {
      "host": "codex",
      "scope": "project"
    }
  ],
  "profile": {
    "projectStage": "greenfield",
    "teamSize": 3,
    "languages": [
      "python"
    ],
    "frameworks": [
      "fastapi",
      "sqlalchemy"
    ],
    "datastores": [
      "postgresql"
    ],
    "constraints": [
      "simple-operations",
      "schema-evolution",
      "transactional-workload"
    ]
  },
  "criticalGoals": [
    "design a normalized relational schema",
    "establish safe schema migrations"
  ],
  "nonCriticalGoals": [
    "choose indexes from access patterns",
    "define transaction boundaries"
  ],
  "minimumNonCriticalGoalCoverage": 0.8,
  "requiresSkill": true,
  "policy": {
    "allowedRisk": [
      "none",
      "safe"
    ],
    "requireKnownSource": false,
    "allowManualSetup": false
  },
  "provenance": {
    "source": "independent-synthetic-held-out",
    "version": "1.0.0",
    "reviewedAt": "2026-07-17"
  },
  "taskFamilyFingerprint": "tf.api-backend-delivery.persistence-data.small-greenfield"
}
