{
  "schemaVersion": 1,
  "caseId": "heldout.agent-mcp-development.evaluation-testing.regulated-high-assurance",
  "intent": "agent-mcp-development",
  "targets": [
    {
      "host": "codex",
      "scope": "project"
    },
    {
      "host": "claude",
      "scope": "project"
    }
  ],
  "profile": {
    "projectStage": "regulated-production",
    "domain": "clinical-document-review",
    "agentShape": "human-supervised-assistant",
    "constraints": [
      "zero-unsafe-action-tolerance",
      "reviewer-provenance",
      "reproducible-evidence",
      "privacy"
    ]
  },
  "criticalGoals": [
    "test safety invariants and correct abstention as hard gates",
    "produce reviewable evaluation evidence with independent judgments"
  ],
  "nonCriticalGoals": [
    "measure subgroup performance",
    "detect data leakage between tuning and held-out sets"
  ],
  "minimumNonCriticalGoalCoverage": 0.8,
  "requiresSkill": true,
  "policy": {
    "allowedRisk": [
      "none",
      "safe"
    ],
    "requireKnownSource": false,
    "allowManualSetup": false
  },
  "provenance": {
    "source": "independent-synthetic-held-out",
    "version": "1.0.0",
    "reviewedAt": "2026-07-17"
  },
  "taskFamilyFingerprint": "tf.agent-mcp-development.evaluation-testing.regulated-high-assurance"
}
