{
  "schemaVersion": 1,
  "caseId": "tuning.web-application-delivery.ui-accessibility.commerce-checkout",
  "intent": "web-application-delivery",
  "targets": [
    {
      "host": "codex",
      "scope": "project"
    }
  ],
  "profile": {
    "projectType": "consumer commerce checkout",
    "languages": [
      "TypeScript"
    ],
    "frameworks": [
      "Next.js",
      "React"
    ],
    "context": "checkout redesign that must prevent accessibility regressions",
    "constraints": [
      "mobile and desktop",
      "CI-friendly checks"
    ]
  },
  "criticalGoals": [
    "wcag-audit",
    "keyboard-and-screen-reader-validation"
  ],
  "nonCriticalGoals": [
    "regression-evidence",
    "accessible-component-guidance"
  ],
  "minimumNonCriticalGoalCoverage": 0.8,
  "requiresSkill": true,
  "policy": {
    "allowedRisk": [
      "none",
      "safe"
    ],
    "requireKnownSource": false,
    "allowManualSetup": false
  },
  "provenance": {
    "source": "independent-synthetic-tuning-authoring",
    "version": "1.0.0",
    "reviewedAt": "2026-07-17"
  },
  "taskFamilyFingerprint": "tuning.v1.web-application-delivery.ui-accessibility.commerce-checkout"
}
