{
  "schemaVersion": 1,
  "caseId": "heldout.security-review-hardening.secrets-auth.production-greenfield",
  "intent": "security-review-hardening",
  "targets": [
    {
      "host": "claude",
      "scope": "project"
    }
  ],
  "profile": {
    "archetype": "production-greenfield",
    "projectSummary": "New customer portal using Supabase authentication and rotated AWS service credentials",
    "stack": {
      "languages": [
        "typescript"
      ],
      "frameworks": [
        "nextjs",
        "supabase"
      ],
      "identity": [
        "supabase-auth"
      ],
      "deployment": [
        "aws"
      ]
    },
    "constraints": [
      "internet-facing",
      "tenant sessions are critical",
      "credential rotation required before launch"
    ],
    "authorization": {
      "scope": "defensive auth and secret lifecycle review of the organization-owned portal",
      "mode": "non-destructive",
      "productionChanges": "approval-required"
    },
    "policy": {
      "allowedRisk": [
        "none",
        "safe"
      ],
      "requireKnownSource": false,
      "allowManualSetup": false
    }
  },
  "criticalGoals": [
    "validate server-side session handling",
    "establish service-secret rotation",
    "prevent credential disclosure"
  ],
  "nonCriticalGoals": [
    "document recovery controls",
    "define pre-launch auth checks"
  ],
  "minimumNonCriticalGoalCoverage": 0.8,
  "requiresSkill": true,
  "policy": {
    "allowedRisk": [
      "none",
      "safe"
    ],
    "requireKnownSource": false,
    "allowManualSetup": false
  },
  "provenance": {
    "source": "aas-v1-independent-synthetic-profile",
    "version": "1.0.0",
    "reviewedAt": "2026-07-17"
  },
  "taskFamilyFingerprint": "tf.security-review-hardening.secrets-auth.production-greenfield"
}
